{
  "project": "[project-name]",
  "mode": "pending",
  "phase": "classify",
  "phase_status": "not-started",
  "gates": {
    "classification": {
      "status": "not-started",
      "required_artifacts": [".codex-brain/classification.json"],
      "missing": [".codex-brain/classification.json"],
      "approved": false,
      "notes": "Codex must classify the project before planning or implementation."
    },
    "validation": {
      "status": "not-started",
      "required_artifacts": [".codex-brain/validation.md"],
      "missing": [".codex-brain/validation.md"],
      "approved": false
    },
    "research": {
      "status": "not-started",
      "required_artifacts": [".codex-brain/research/"],
      "missing": [".codex-brain/research/"],
      "approved": false
    },
    "agentic_opportunity": {
      "status": "not-started",
      "required_artifacts": ["docs/agentic-opportunity-audit.md", "docs/intelligence-system-plan.md"],
      "missing": ["docs/agentic-opportunity-audit.md", "docs/intelligence-system-plan.md"],
      "approved": false,
      "notes": "Decide whether the idea should become a normal app, AI-assisted workflow, memory-backed copilot, workflow agent, bounded operator, or domain operating system before mapping access."
    },
    "agent_engineering": {
      "status": "not-started",
      "required_artifacts": ["docs/agent-engineering-audit.md", "docs/skill-inventory.md"],
      "missing": ["docs/agent-engineering-audit.md", "docs/skill-inventory.md"],
      "approved": false,
      "notes": "Audit production-agent engineering readiness and map required procedural skills before choosing capability/access surfaces."
    },
    "capability_access": {
      "status": "not-started",
      "required_artifacts": ["docs/capability-access-map.md"],
      "missing": ["docs/capability-access-map.md"],
      "approved": false,
      "notes": "Map required APIs, SDKs, CLIs, MCP servers, generated harnesses, browser workflows, credentials, mocks, and live verification before Build Plan approval."
    },
    "plan": {
      "status": "not-started",
      "required_artifacts": ["docs/build-plan.md"],
      "missing": ["docs/build-plan.md"],
      "approved": false
    },
    "design_dna": {
      "status": "not-started",
      "required_artifacts": ["design/design-dna.md", "design/tokens.json"],
      "missing": ["design/design-dna.md", "design/tokens.json"],
      "approved": false
    },
    "decomposition": {
      "status": "not-started",
      "required_artifacts": ["docs/prd/"],
      "missing": ["docs/prd/"],
      "approved": false
    },
    "execution": {
      "status": "not-started",
      "required_artifacts": [".codex-brain/task-records/"],
      "missing": [],
      "approved": false
    },
    "review": {
      "status": "not-started",
      "required_artifacts": ["reviews/"],
      "missing": ["reviews/"],
      "approved": false
    },
    "ship": {
      "status": "not-started",
      "required_artifacts": ["docs/ship-checklist.md"],
      "missing": ["docs/ship-checklist.md"],
      "approved": false
    },
    "learn": {
      "status": "not-started",
      "required_artifacts": [".codex-brain/lessons/"],
      "missing": [],
      "approved": false
    }
  },
  "design_dna": {
    "required": false,
    "status": "not-required",
    "references_collected": false,
    "tokens_approved": false,
    "motion_direction": "",
    "frontend_unblocked": false
  },
  "project_context": {
    "path": ".codex-brain/project-context.md",
    "status": "draft",
    "last_updated": null
  },
  "distillates": {
    "project": null,
    "research": null,
    "agentic_opportunity": null,
    "intelligence_system": null,
    "agent_engineering": null,
    "skill_inventory": null,
    "capability_access": null,
    "build_plan": null,
    "execution": null
  },
  "context": {
    "last_session_id": null,
    "last_session_path": null,
    "last_saved_at": null,
    "last_summary": null,
    "last_next_action": null,
    "last_context_health_score": null,
    "last_context_health_ok": null,
    "unsaved_changes": false
  },
  "current_task": {
    "id": null,
    "prd": null,
    "claimed_by": null,
    "claimed_at": null
  },
  "lessons": {
    "captured_count": 0,
    "promotion_candidates": []
  }
}
